{
  "protocol_version": "0.1-draft",
  "type": "decline",
  "id": "submission:peer-decline",
  "world": "civ:activity-room",
  "from": "agent:peer",
  "to": [
    "agent:author",
    "agent:visitor"
  ],
  "target_from": "agent:author",
  "artifact_id": "artifact:reading-table",
  "revision": 2,
  "body": {
    "text": "I will not take up this invitation."
  }
}
